{
  "schema_version": 1,
  "campaign_id": "gpt-pro-wave-2026-07-16",
  "workload_id": "testdiet",
  "job_id": "testdiet-14",
  "attempt_id": "a01",
  "package_revision": "r01",
  "state": "rejected",
  "provider": "chatgpt",
  "provider_conversation_id": null,
  "provider_turn_id": null,
  "polylogue_session_ref": null,
  "prompt_sha256": "de4f81015993f194ce07362404975ef0fb4a0f736db565418c9d2f401ed95793",
  "snapshot_identity": null,
  "supersedes_attempt_id": null,
  "artifacts": [{"filename":"testdiet-14-config-path-coherence-r01.zip","sha256":"3af2cc3ec0a1772a590dcfeab3f2e4273e4c9a672cfed1c648d387219a42256e","size_bytes":3624,"custody_path":"testdiet/results/testdiet-14/a01/raw/testdiet-14-config-path-coherence-r01.zip","polylogue_attachment_ref":null}],
  "triage": "Rejected: 53-byte invalid PATCH.diff, empty recovery object, and no HANDOFF, TESTS, or EVIDENCE deliverables.",
  "beads": ["polylogue-fd2s", "polylogue-9gh1", "polylogue-cxlk", "polylogue-ovme"],
  "worktree": null,
  "agent_handle": null,
  "commits": [],
  "pull_request": null,
  "verification_receipts": ["ZIP members and SHA-256 verified", "PATCH.diff is not valid for git apply"],
  "notes": "Mission text retained as research context only; no implementation is authorized."
}
