{
  "schema_version": 1,
  "campaign_id": "gpt-pro-wave-2026-07-16",
  "workload_id": "beads",
  "job_id": "beads-06",
  "attempt_id": "a01",
  "package_revision": "r04",
  "state": "triaged",
  "provider": "chatgpt",
  "provider_conversation_id": null,
  "provider_turn_id": null,
  "polylogue_session_ref": null,
  "prompt_sha256": "c4232090c9fd8d751acf064ad95165e91f3c285a1080939167418d4986735a5b",
  "snapshot_identity": "f654480cadb7cc4c194704e24dfd483199547b35",
  "supersedes_attempt_id": null,
  "artifacts": [{"filename":"beads-06-agent-manual-install-r04.zip","sha256":"27c53ff948b0432052c981a35de15b29a7cbefd0cbdf67972d4d586b0f17048b","size_bytes":84777,"custody_path":"beads/results/beads-06/a01/raw/beads-06-agent-manual-install-r04.zip","polylogue_attachment_ref":null}],
  "triage": "Snapshot-relative candidate for project-owned agent manual and installer; reconcile its 29-file patch against the live declaration graph and current MCP registration before source admission.",
  "beads": ["polylogue-3gd.2", "polylogue-3gd.3"],
  "worktree": null,
  "agent_handle": null,
  "commits": [],
  "pull_request": null,
  "verification_receipts": ["ZIP members and SHA-256 verified", "git apply --check against current master failed"],
  "notes": "Provider-run tests/builds are evidence only; live clients, Nix/Home Manager, and installed-runtime claims remain unverified."
}
