{
  "schema_version": 1,
  "campaign_id": "gpt-pro-wave-2026-07-16",
  "workload_id": "testdiet",
  "job_id": "testdiet-04",
  "attempt_id": "a02",
  "package_revision": "r01",
  "state": "triaged",
  "provider": "chatgpt",
  "provider_conversation_id": null,
  "provider_turn_id": null,
  "polylogue_session_ref": null,
  "prompt_sha256": "72b34413851a796814cf1bddde0821317ed836382dd55857239598b4c4efe072",
  "snapshot_identity": "b9052e09103502017c0f510ecc699aac395de23c",
  "supersedes_attempt_id": null,
  "artifacts": [{"filename":"testdiet-04-derived-freshness-r01.zip","sha256":"226be0e25fae6de8cfd087d84eefcaf8c9ca2b7797d341c66b26d8785e66ce8e","size_bytes":61199,"custody_path":"testdiet/results/testdiet-04/a02/raw/testdiet-04-derived-freshness-r01.zip","polylogue_attachment_ref":null}],
  "triage": "Substantial snapshot-relative candidate for shared derivation identity and conditional freshness receipts; reconcile with current derived-tier schemas before source admission.",
  "beads": ["polylogue-wmsc", "polylogue-1xc.12"],
  "worktree": null,
  "agent_handle": null,
  "commits": [],
  "pull_request": null,
  "verification_receipts": ["ZIP members and SHA-256 verified", "clipboard report matched this package hash", "git apply --check against current master failed"],
  "notes": "Does not replace the prior evidence-only r02 package or local verification."
}
