{
  "schema_version": 1,
  "campaign_id": "gpt-pro-wave-2026-07-16",
  "workload_id": "testdiet",
  "job_id": "testdiet-03",
  "attempt_id": "a01",
  "package_revision": "r01",
  "state": "triaged",
  "provider": null,
  "provider_conversation_id": null,
  "provider_turn_id": null,
  "polylogue_session_ref": null,
  "prompt_sha256": "8ee04b055ed997375ad8eeb0d8ba24c566085ad014f55fa53620afc42b4d1764",
  "snapshot_identity": "f654480cadb7cc4c194704e24dfd483199547b35",
  "supersedes_attempt_id": null,
  "artifacts": [
    {
      "filename": "testdiet-03-rebuild-equivalence-r01.zip",
      "sha256": "c3843babc8fc0126401e471c9eaee1db26ad5ccdcabf0e1697d01157e591e47e",
      "size_bytes": 26025,
      "custody_path": "testdiet/results/testdiet-03/a01/raw/testdiet-03-rebuild-equivalence-r01.zip",
      "polylogue_attachment_ref": null
    }
  ],
  "triage": "patch applies cleanly",
  "beads": [],
  "worktree": null,
  "agent_handle": null,
  "commits": [],
  "pull_request": null,
  "verification_receipts": [],
  "notes": "created by triage-package.py; later integration evidence belongs in a new immutable receipt revision"
}
